[
  {
    "id": "PY-L1-001",
    "skill": "py",
    "level": 1,
    "type": "explain",
    "topics": [
      "py-control-flow"
    ],
    "question": "How does Python evaluate 'and' and 'or'? Explain why 'if user is not None and user.age > 18:' is safe when user is None, and what the condition 'if colour == \"red\" or \"blue\":' actually tests.",
    "model_answer": "'and' and 'or' short-circuit: 'and' stops at the first falsy operand and 'or' stops at the first truthy one, so the right side is evaluated only if it is needed. When user is None the left side is False, so user.age is never evaluated and no error is raised. 'colour == \"red\" or \"blue\"' is read as '(colour == \"red\") or \"blue\"'; a non-empty string is truthy, so the condition is always true. It should be written colour == \"red\" or colour == \"blue\", or colour in (\"red\", \"blue\").",
    "key_points": [
      "and/or short-circuit: the right side is evaluated only when needed",
      "user.age is never evaluated when user is None",
      "colour == \"red\" or \"blue\" is always true because \"blue\" is truthy",
      "Correct form: colour in (\"red\", \"blue\") or two comparisons"
    ],
    "rubric": {
      "0": "Says both sides are always evaluated, or says the colour condition checks red or blue",
      "1": "Explains short-circuiting but misreads the colour condition, or the reverse",
      "2": "Explains short-circuiting, why the user check is safe, and why the colour condition is always true, with the fix"
    },
    "misconceptions": [
      "py.control-flow.no-short-circuit",
      "py.control-flow.or-distributes"
    ],
    "source": "generated",
    "status": "draft"
  },
  {
    "id": "PY-L1-002",
    "skill": "py",
    "level": 1,
    "type": "explain",
    "topics": [
      "py-collections"
    ],
    "question": "What is the difference between sorted(nums) and nums.sort() for a list nums? What does each one return, and could you call .sort() on a tuple?",
    "model_answer": "sorted(nums) returns a new sorted list and leaves nums unchanged; it works on any iterable. nums.sort() sorts the list in place and returns None, so result = nums.sort() sets result to None. Tuples are immutable and have no sort() method; to sort one you use sorted(t), which returns a list.",
    "key_points": [
      "sorted() returns a new list and leaves the original unchanged",
      "list.sort() sorts in place and returns None",
      "Tuples are immutable, have no sort(); use sorted() instead"
    ],
    "rubric": {
      "0": "Says nums.sort() returns the sorted list, or that a tuple can be sorted in place",
      "1": "Knows one sorts in place and one returns a new list, but gets the return value of sort() or the tuple part wrong",
      "2": "Correct on both functions, including that sort() returns None, and on tuples"
    },
    "misconceptions": [
      "py.collections.sort-returns-list",
      "py.collections.tuple-mutable"
    ],
    "source": "generated",
    "status": "draft"
  },
  {
    "id": "PY-L1-003",
    "skill": "py",
    "level": 1,
    "type": "explain",
    "topics": [
      "py-variables-mutability"
    ],
    "question": "A colleague tries to tidy a list of names with 'for name in names: name.strip().title()'. Afterwards the list is unchanged. They then try 'name = name.strip().title()' inside the loop, and it is still unchanged. Explain both results and show a correct way to do it.",
    "model_answer": "Strings are immutable, so strip() and title() never change the original string; they return a new string, which the first version simply throws away. The second version keeps the new string but only rebinds the loop variable name; it does not put anything back into the list. To change the list you must build a new list, for example names = [n.strip().title() for n in names], or assign by index with names[i] = names[i].strip().title().",
    "key_points": [
      "String methods return a new string and leave the original unchanged",
      "Assigning to the loop variable does not change the list element",
      "Fix: build a new list (comprehension) or assign back with names[i] = ..."
    ],
    "rubric": {
      "0": "Says strip()/title() change the string in place, or that the first loop should have worked",
      "1": "Explains string immutability but not why the second attempt fails, or gives no working fix",
      "2": "Explains both failures (new string discarded; loop variable rebound) and gives a correct fix"
    },
    "misconceptions": [
      "py.variables-mutability.string-method-mutates"
    ],
    "source": "generated",
    "status": "draft"
  },
  {
    "id": "PY-L1-004",
    "skill": "py",
    "level": 1,
    "type": "explain",
    "topics": [
      "py-control-flow"
    ],
    "question": "What is the difference between an if/elif/else chain and several separate if statements? Give an example where they behave differently.",
    "model_answer": "In an if/elif/else chain Python checks the conditions from top to bottom and runs only the first branch whose condition is true; the rest are skipped. Separate if statements are each checked independently, so several of them can run. For example, with score = 95, 'if score > 90: grade A' followed by 'elif score > 80: grade B' gives only A, but two separate ifs would run both and the second would overwrite the grade with B.",
    "key_points": [
      "An if/elif chain runs at most one branch: the first whose condition is true",
      "Separate if statements are all checked, so several can run",
      "A concrete example where overlapping conditions give different results"
    ],
    "rubric": {
      "0": "Says an elif chain runs every branch whose condition is true, or that the two forms are equivalent",
      "1": "Correct idea but no valid example, or the example is confused",
      "2": "Explains that elif stops at the first true condition, contrasts with separate ifs, and gives a correct example"
    },
    "misconceptions": [
      "py.control-flow.elif-checks-all"
    ],
    "source": "generated",
    "status": "draft"
  },
  {
    "id": "PY-L1-005",
    "skill": "py",
    "level": 1,
    "type": "explain",
    "topics": [
      "py-collections"
    ],
    "question": "You need to store a GPS location (latitude, longitude). Would you use a list or a tuple, and why? What happens if you write loc[0] = 51.5 when loc is a tuple, and which of the two could you use as a key in a dictionary that maps locations to place names?",
    "model_answer": "A tuple is the natural choice: a location is a fixed pair of values that should not change, and tuples are immutable. Assigning loc[0] = 51.5 on a tuple raises a TypeError, because tuples do not support item assignment; to 'change' it you build a new tuple. Because a tuple of numbers is immutable it is hashable, so it can be a dict key; a list is mutable and unhashable, so using it as a key raises TypeError.",
    "key_points": [
      "Tuples are immutable; item assignment on a tuple raises TypeError",
      "To change a tuple you create a new one",
      "A tuple of numbers can be a dict key; a list cannot, because it is unhashable"
    ],
    "rubric": {
      "0": "Says the tuple can be changed in place like a list, or that a list works as a dict key",
      "1": "Knows tuples are immutable but is wrong or unsure about which can be a dict key, or the reverse",
      "2": "Chooses a tuple with a reason, says loc[0] = ... raises TypeError, and that only the tuple can be a key"
    },
    "misconceptions": [
      "py.collections.tuple-mutable",
      "py.collections.unhashable-key"
    ],
    "source": "generated",
    "status": "draft"
  },
  {
    "id": "PY-L1-006",
    "skill": "py",
    "level": 1,
    "type": "explain",
    "topics": [
      "py-variables-mutability"
    ],
    "question": "You write total = price * qty and later set qty = 5. Does total change? Now compare: basket = items, followed by items.append(\"pen\"). Does basket change? Explain why the two cases behave differently.",
    "model_answer": "total does not change: the expression price * qty is evaluated once, and total holds the resulting number, not the formula. Rebinding qty later just points qty at a new value. In the second case basket = items does not copy anything; both names refer to the same list object. append mutates that one object, so the change is visible through basket too. The difference is rebinding a name versus mutating a shared object.",
    "key_points": [
      "A variable holds the value computed at assignment, not the expression",
      "basket = items makes a second name for the same list, not a copy",
      "append mutates the shared object, so both names see the change"
    ],
    "rubric": {
      "0": "Says total is recalculated when qty changes, or that basket is an independent copy of items",
      "1": "Gets one of the two cases right, or both answers right without explaining value vs shared reference",
      "2": "Both answers right: total keeps its old value, basket sees 'pen' because both names refer to one list"
    },
    "misconceptions": [
      "py.variables-mutability.variable-holds-expression",
      "py.variables-mutability.assignment-copies"
    ],
    "source": "generated",
    "status": "draft"
  },
  {
    "id": "PY-L1-007",
    "skill": "py",
    "level": 1,
    "type": "read-code",
    "topics": [
      "py-control-flow"
    ],
    "question": "What does this code print, and why?",
    "code": "total = 0\nfor n in range(1, 7, 2):\n    total += n\nprint(total)\nfor n in range(4, 0, -2):\n    if n > 3:\n        print(n, \"high\")\n    elif n > 1:\n        print(n, \"mid\")\n    else:\n        print(n, \"low\")",
    "expected_output": "9\n4 high\n2 mid\n",